{
  "$schema": "https://json-schema.org/draft/2020-12/schema",
  "$id": "https://github.com/rickl/quire/schema/source.schema.json",
  "title": "Quire configured source",
  "description": "A user-supplied instantiation of a theme. Quire ships none of these: the repository contains no source URLs and no default catalogue (PLAN §1.3). The user adds each entry themselves, and is responsible for the legality of the sources they configure.",
  "type": "object",
  "additionalProperties": false,
  "required": ["id", "name", "lang", "theme", "baseUrl", "addedAt"],
  "properties": {
    "id": {
      "type": "string",
      "description": "Stable local identifier. Never derived from the URL, so a source can be re-pointed without orphaning downloaded volumes.",
      "pattern": "^[a-z0-9][a-z0-9-]{0,63}$"
    },
    "name": {
      "type": "string",
      "description": "Display name. Defaulted from the site <title> at probe time (PLAN §7.5 stage 6), then user-editable.",
      "minLength": 1,
      "maxLength": 120
    },
    "lang": {
      "type": "string",
      "description": "BCP-47 language tag of the source's content.",
      "pattern": "^[a-z]{2,3}(-[A-Za-z0-9]{2,8})*$"
    },
    "theme": {
      "type": "string",
      "description": "Registered theme ID that drives this source. 'generic' is the raw-selector escape hatch (PLAN §6 M2) and is the only value for which 'selectors' is permitted.",
      "pattern": "^[a-z0-9][a-z0-9_-]{0,63}$"
    },
    "baseUrl": {
      "type": "string",
      "format": "uri",
      "description": "Site root, scheme included. http(s) only; enforced again at fetch time by the SSRF guard (PLAN §7.4).",
      "pattern": "^https?://[^\\s/$.?#][^\\s]*$",
      "maxLength": 2048
    },
    "overrides": {
      "type": "object",
      "description": "Per-theme, schema-declared knobs. Each theme declares which keys it accepts and their defaults. PLAN §7.2: unknown keys are a validation error, not silently ignored -- so the permitted set is validated by the theme at load time, not here.",
      "default": {}
    },
    "selectors": {
      "type": "object",
      "description": "Raw selectors. ONLY valid when theme == 'generic'. Enforced by the allOf clause below.",
      "default": {}
    },
    "script": {
      "type": "string",
      "description": "Optional goja script hook. ONLY valid when theme == 'generic'. An escape hatch, not the main path (PLAN §6 M2).",
      "maxLength": 65536
    },
    "allowedHosts": {
      "type": "array",
      "description": "Extra hosts a redirect may land on. Absent this, the fetch layer rejects any redirect leaving baseUrl's registrable domain (PLAN \u00a77.4). Image CDNs are the usual reason to set it. \"example.test\" matches that host and anything under it; \"*.example.test\" matches subdomains only. PLAN \u00a77.5 stage 6 seeds this from the theme's own declared hosts, so it is usually already correct. It widens only the registrable-domain boundary: private, loopback and link-local addresses stay refused however they are named.",
      "items": { "type": "string", "pattern": "^(\\*\\.)?[a-z0-9.-]+$" },
      "uniqueItems": true,
      "default": []
    },
    "rateLimit": {
      "type": "object",
      "description": "Per-source politeness. These narrow the global caps in PLAN §7.4 but can never widen them -- the fetch layer takes the stricter of the two, and the global floor is not configurable.",
      "additionalProperties": false,
      "properties": {
        "requestsPerMinute": { "type": "integer", "minimum": 1, "maximum": 120, "default": 30 },
        "concurrency": { "type": "integer", "minimum": 1, "maximum": 8, "default": 2 }
      },
      "default": { "requestsPerMinute": 30, "concurrency": 2 }
    },
    "splitStrips": {
      "type": "string",
      "description": "Vertical-scroll ('webtoon') strip splitting, PLAN §12.3. Tall single-image pages are cut into panel-shaped pages instead of being fitted into a 3:4 page as an unreadable centred sliver. Detection is per *image*, never per source -- a single index, and a single series, hosts both formats -- and it is biased hard toward doing nothing: a strip left unsplit is a sliver the reader can see, whereas a manga page wrongly split is mangled art across a whole volume, silently. 'auto' requires an aspect past the measured threshold (h:w 3.76, the empty middle between two stacked pages at 2.83 and the shortest real strip at 5.0) AND either corroboration from the rest of the chapter or a ratio past 10:1 that nothing else explains. 'never' disables it for this source. 'always' waives detection and hands every image to the splitter, which still leaves anything that already fits one page alone. This is an escape hatch: detection will eventually be wrong and the user should not have to wait for a release.",
      "enum": ["auto", "never", "always"],
      "default": "auto"
    },
    "enabled": {
      "type": "boolean",
      "description": "Per-source toggle surfaced in the source list (PLAN §6 M3).",
      "default": true
    },
    "addedAt": {
      "type": "string",
      "format": "date-time"
    },
    "lastProbe": {
      "type": "object",
      "description": "Result of the most recent probe. Re-probed on failure (PLAN §6 M7) so a site that switched themes or added a challenge is reported as such, not as 'no results found'.",
      "additionalProperties": false,
      "required": ["verdict", "at"],
      "properties": {
        "verdict": {
          "type": "string",
          "description": "PLAN §7.5 verdict enum. 'blocked_challenge' is terminal: the source is refused, never added in a degraded state.",
          "enum": [
            "ok",
            "partial",
            "unrecognised",
            "blocked_challenge",
            "robots_denied",
            "unreachable",
            "invalid_url",
            "blocked_address"
          ]
        },
        "at": { "type": "string", "format": "date-time" },
        "detail": {
          "type": "string",
          "description": "Plain language, shown to the user as-is. PLAN §6 M3: a verdict is a complete final answer, not an error code and not a retry prompt.",
          "maxLength": 2000
        },
        "themeScores": {
          "type": "object",
          "description": "Fingerprint scores per theme from stage 4, kept so an 'unrecognised' verdict can name what was tried (PLAN §7.5).",
          "additionalProperties": { "type": "integer", "minimum": 0, "maximum": 100 }
        }
      }
    }
  },
  "allOf": [
    {
      "if": { "properties": { "theme": { "const": "generic" } }, "required": ["theme"] },
      "else": {
        "properties": {
          "selectors": false,
          "script": false
        }
      }
    }
  ]
}
